number,TeacherID,speaker,utterance,ut,rc,UMAP_best_dim_1,UMAP_best_dim_2
289,3026,T,It’s is in disequilibrium and the only way for it to even out is to do what?,Q,SK,-7.724308,0.49727637
290,3026,S,Erupts. ,Rs,SK,-5.655149,14.872024
291,3026,T,It has to erupt. ,Fy,SK,6.337154,-20.386742
292,3026,T,"Once it erupts it released the pressure and we’re back in balance, so that would be true on that question. ",E,SK,4.9012356,16.54659
293,3026,T,"Ok, this was a fill in the blank. We talked about this. When you eat a big hamburger for lunch and you digest it you get an increase in what? ",Q,SK,-4.8645186,-17.592833
294,3026,S,Negative ,Rs,SK,9.050532,-7.7808943
295,3026,T,"Ok. Alright, yesterday we talked about speed – about what average speed vs. instantaneous speed meant. ",E,SK,-7.97834,10.011731
296,3026,T,"Jason, can you throw your gum in the trash please? Thank you very much.  ",P,,10.289341,6.4615517
297,3026,T,"So we talked about average speed being an average of all the speeds of your total trip from point A to point B. All the speeds that you went… Remember, we talked about you’re not going to go the whole speed the whole time you’re driving, right?",E,SK,11.711241,-5.907302
298,3026,T,"You’re going to speed up or slow down,",E,OD,3.1089506,6.472457
299,3026,T,so your average speed is going to be your total distance over what? Your total what?,Q,SK,-16.55355,8.498746
300,3026,S,Time. ,Rs,SK,-16.809086,8.537455
301,3026,T,"Time, right? Thank you, Marcus; total time. ",Fs,SK,-16.604563,8.173947
302,3026,T,So instantaneous speed – what is instantaneous speed again?,Q,SK,12.288655,-16.327913
303,3026,S,Speed that [inaudible] ,Rs,SK,-7.4433126,9.523064
304,3026,T,"It’s the speed that you’re going at, but at any one given time – at that instant. ",Fs,SK,-8.032101,10.0969925
305,3026,T,Think of the word instantaneous. ,E,SK,-5.1974,-17.923954
306,3026,T, It means at that one instant how fast are you going. ,E,SK,12.271906,-16.34476
307,3026,T,"Cory, let me see your pass, sweetie. ",P,,-7.8431883,8.39085
308,3026,T,What do I mean by constant speed? ,Q,SK,3.1320024,6.5107245
309,3026,T,You’ll find that on 134. ,P,,-8.262125,14.063819
310,3026,T,What is the constant speed? ,Q,SK,-0.33302778,-10.918659
311,3026,S,Staying the same? ,Rs,SK,-5.2236986,-17.950558
312,3026,T,Yeah. What’s staying the same for a period of time?,Fq,SK,-2.2017803,0.124683835
313,3026,S,Speed? ,Rs,SK,-8.166843,10.122213
314,3026,T,Your speed; constant speed. ,Fs,SK,3.1244953,6.4764457
315,3026,T,"So if you’re going at a constant speed of 50, that means you’re not going to increase or decrease your speed; ",E,OD,12.219456,-16.396242
316,3026,T,you’re just going to stay the same. ,E,OD,1.641119,-4.5567427
317,3026,T,"So if we graph that, you’re going to notice that your graph isn’t going anywhere because you’re going to stay steady at a constant speed.",E,PD,-2.1552281,0.08330909
318,3026,T,You’ll see more what I’m talking about when we get into our lab today. ,P,,-7.195009,0.35020345
319,3026,T,"And then we need to look at the relationship between velocity and acceleration, ",P,,-1.9375225,8.217585
320,3026,T,"and the only way to do this is to actually get involved, and we’re going to do some motion graphing today, ",P,,-7.1681576,0.3757038
321,3026,T,"ok? So what is velocity? We haven’t really hit on this much yet, but just give me the definition for velocity. ",Q,SK,8.85752,-7.9587865
322,3026,S,Velocity?,Rs,SK,-1.7501585,8.133432
323,3026,T,Uh huh. ,P,,-3.7049603,14.995148
324,3026,S,Velocity is the speed of an object in the direction it’s headed.,Rs,SK,18.991474,-4.6508856
325,3026,T,"Ok, so velocity is the speed of an object in the direction it’s headed, ok? ",Fs,SK,18.991884,-4.65128
326,3026,T,There’s a nice little picture of that on 135. ,P,,4.95423,18.199766
327,3026,T,It shows someone walking around a park. ,E,OD,-7.691159,-6.070603
328,3026,S,Mine’s got a [inaudible] ,Rs,OD,-6.3282924,2.5601194
329,3026,T,"Those balls are actually showing acceleration, ",E,OD,-7.2005954,0.31385952
330,3026,T,"so my next question is: What is the relationship between velocity and acceleration, ok?  ",Q,SK,-1.5045521,8.458866
331,3026,T,"Velocity we’re looking at the direction; we’re speeding and we have to go in a direction, right? ",E,OD,-16.170164,8.753159
332,3026,T,"If we’re speeding we’re moving, aren’t we? ",Q,OD,-7.8034205,8.392911
333,3026,S,Acceleration means speeding up. ,Rs,SK,-8.332045,14.236301
334,3026,T,Acceleration means it’s speeding up? ,Fq,SK,-8.275847,14.163132
335,3026,S,It changes velocity. ,Rs,SK,9.615901,7.1653633
336,3026,T,"Ok, so the change in velocity,",Fs,SK,-1.4879423,8.520345
337,3026,T,which means what’s changing? ,Fq,SK,-1.5824136,8.399207
338,3026,S,The speed.,Rs,SK,-8.113012,10.097183
339,3026,T,Or the… ,Fq,SK,-11.224791,-9.848846
340,3026,S,Or the direction. ,Rs,SK,6.2111444,-20.296778
341,3026,T,Or the direction.,Fs,SK,6.2563286,-20.279099
342,3026,T,"So that’s how velocity and acceleration are related,",E,SK,-1.5418884,8.574625
343,3026,T,because the acceleration is when you change speed or you change direction. ,E,SK,-1.8824306,8.262977
344,3026,T,"Ok, now let’s look at the graph. ",P,,6.131745,-20.306906
345,3026,T,This is a time graph. ,E,OD,-2.1361637,0.060645446
346,3026,T, Shh. One… Put the calculator down for a second. ,P,,3.0903862,6.481013
347,3026,T,"Look up here. Cory. Alright, we have a time graph. ",P,OD,-19.325384,7.3793907
348,3026,T,What is on our axis?,Q,OD,-8.270144,21.14006
349,3026,S,TS. ,Rs,OD,-8.051072,10.0331545
350,3026,T,"What does the T stand for, probably?",Q,OD,-8.330287,13.738044
351,3026,S,Time. ,Rs,OD,-16.792671,8.492027
352,3026,T,Time. ,Fy,OD,-16.851513,8.618676
353,3026,T,What does the S stand for? ,Q,SK,-8.251831,14.108629
354,3026,S,Distance. No. ,Rs,SK,-8.237172,21.107775
355,3026,T,S. ,Q,SK,-11.014158,-9.939513
356,3026,S,Speed. ,Rs,OD,-8.013463,10.199914
357,3026,T,What is speed? ,Q,SK,-8.05374,10.032623
358,3026,T,What is the measure of the speed? ,Q,SK,-7.8686657,8.711868
359,3026,T,Distance over what? ,Q,SK,-8.242919,21.090454
360,3026,S,Time. ,Rs,SK,-16.913631,8.448632
361,3026,T,"Time,",Fy,SK,-16.907722,8.706996
362,3026,T,so what unit would S be for time? ,Fq,SK,-8.047885,21.226341
363,3026,T,I know you all aren’t awake.,P,,1.7893947,2.413293
364,3026,T,"If we’re on the highway we say we measure miles per hour, ",E,OD,-7.828098,8.439238
365,3026,T,so what would the S be? ,Q,SK,-11.1144905,-9.822648
366,3026,S,Miles per hour? Second?,Rs,SK,-8.274929,14.17966
367,3026,T,Nope.,Fy,SK,9.627816,7.1312304
368,3026,S,Speed. Speed. ,Rs,SK,-0.29670855,-10.953965
369,3026,T,Thank you. We’re doing meters. ,Fs,SK,-7.2215314,0.2986377
370,3026,S,Miles per second. ,Rs,SK,-8.23013,14.051142
371,3026,T,"We just set up what unit for distance, guys? ",Q,SK,-6.728446,19.540298
372,3026,S,Meters. ,Rs,SK,-6.379716,2.4974449
373,3026,T,"Meters, so we’re going meters per second. ",Fs,SK,-6.1268826,2.8428183
374,3026,T,"So you see on the X axis we have our time in seconds, ",E,OD,8.908591,-8.016762
375,3026,T,and on our Y what do we have? ,Q,OD,-11.172029,-9.907045
376,3026,S,Distance. ,Rs,OD,-8.198576,21.159115
377,3026,T,We have our distance in meters. ,Fs,OD,-8.335501,21.020548
378,3026,T,"So Jason, what he’s going to do is he has to look at the graph",E,OD,-0.28921288,-10.959206
379,3026,T,"and he has to figure out where to start,",E,OD,-19.29598,7.4171367
380,3026,T,and he’s going to walk in front of the motion detector ,E,OD,-7.4245753,-6.6918306
381,3026,T,and it’s going to record where he’s walking.,E,OD,-1.4458573,8.535064
382,3026,T,It’s going to record where he’s walking. ,E,OD,-1.5278378,8.582357
383,3026,T,So he’s going to try to match the graph on the screen. ,E,OD,4.8484807,16.591984
384,3026,T,"I’m just going to give you a clue, ",E,OD,1.6369375,-4.921526
385,3026,T,so you need to study it so you know where to start. ,E,OD,10.217698,6.532057
386,3026,T,"So look at, look at where the graph starts. ",E,OD,-4.876564,-17.604841
387,3026,T,"How many meters should he be from this motion detector, Lavelle? ",Q,OD,-7.773261,-5.958777
388,3026,S,One. Four. ,Rs,OD,-10.991049,-9.704999
389,3026,T,"Ok, here’s some good graphs.",E,OD,-7.6605115,-6.1089087
390,3026,T,Who’s this right here?  Let me get it going. ,P,OD,5.713105,-19.87195
391,3026,T,Let me get these graphs up. ,P,OD,18.84746,-4.5065293
392,3026,T,Look at number one. ,P,OD,0.51346326,1.1496936
393,3026,T,Describe how you had to match your graph to each segment of the graph. ,P,OD,-1.9158609,-0.16910927
394,3026,T,"So if your graph was going at a slope that was a steep slope, what did you have to do? ",Q,OD,-7.950942,0.28239632
395,3026,T,If it was a straight line what did you have to do? ,Q,OD,-7.7019777,21.417513
396,3026,S,Oh.,Ry,,9.034024,-7.9905815
397,3026,T,"This person did a really good job, I think.",Fs,,8.563601,-6.685921
398,3026,S,That was mine. ,Rs,,-11.186057,-9.872887
399,3026,T,"Oh, it was? ",Fq,,8.93914,-7.914458
400,3026,S,Uh unh. It can’t be.,Rs,,-19.332808,7.415468
401,3026,T,"So this one did pretty good, too. ",Fs,,-7.4358273,-6.753539
402,3026,S,That’s mine. That one in the corner is messed up; that’s mines. ,Rs,,-1.7889584,8.095399
403,3026,T,Mines or just mine? ,Fs,,-8.322368,21.034468
404,3026,S,Mines ain’t a word. ,Rs,,-6.782586,19.594538
405,3026,T,It’s not a word. ,Fs,,-5.546823,14.761297
406,3026,S,There it goes. Mines ain’t no word. ,Rs,,-6.7619743,19.573753
407,3026,S,Mine is a word that you can barely see. ,Rs,,-3.7508245,14.948279
408,3026,S,Mines is mines. That’s mine right there. ,Rs,,-8.135314,21.109373
409,3026,T,"Look at this one. Describe to me on your particular graph, on number one,",P,OD,0.504722,1.2232286
410,3026,T,"what did you have to do in order to match the segment of the graph,  ",Q,OD,4.849166,16.593124
411,3026,T,ok? So for this graph what did he have to do to make it a straight line? ,Q,OD,-3.6933217,15.003675
412,3026,S,Be still? ,Rs,OD,-11.193241,-9.965627
413,3026,T,"He had to be still, right? ",Fy,OD,-16.795792,8.569332
414,3026,T,So that’s what you should be describing to me.,P,OD,9.645809,7.1201572
415,3026,T,What did you have to do to make the line go down? ,Q,OD,-0.051344775,18.129583
416,3026,S,Move closer. ,Rs,OD,-5.583845,14.763478
417,3026,T,"You had to move closer to the wall, right? ",Fs,OD,-0.054086346,18.12672
418,3026,T,"Ok, what did you have to do to make the line go up? ",Q,OD,4.9790273,18.224556
419,3026,S,Move back. ,Rs,OD,-11.167675,-9.813075
420,3026,T,"You had to go back,",Fs,OD,-11.057995,-9.791305
421,3026,T,because you’re increasing your what? On the X axis? ,Fq,OD,-7.541878,-6.3128357
422,3026,S,"Um, um… ",Ry,,-3.7125554,14.986715
423,3026,T,Your distance. ,Fs,OD,-8.158645,21.057756
424,3026,T,Ok? So is direction important on your graph? ,Q,OD,6.0452914,-20.141516
425,3026,S,Yeah. ,Ry,OD,1.6407608,-5.008775
426,3026,T,"Yes, that’s where your velocity comes in",Fs,OD,-1.7874417,8.086216
427,3026,T,your direction and your speed. ,E,OD,5.883274,-20.01907
428,3026,T,"Now, how fast…. Does your speed effect the graph? ",Q,PD,-5.187782,-17.91481
429,3026,T,The straightness of it? ,Q,PD,-5.2163234,-17.943283
430,3026,S,Yes. ,Ry,PD,-8.297329,21.057283
431,3026,T,How? How does speed come into play here? ,Fq,PD,-8.2533245,13.901426
432,3026,S,Because you’ve got to [inaudible] back. ,Rs,PD,-6.145159,2.804188
433,3026,T,You’re got to what?,Fq,PD,-7.370904,-6.770559
434,3026,S,Move back. ,Rs,PD,-11.321783,-9.586984
435,3026,S,Move as fast as you can then [inaudible]. ,Rs,PD,-6.3215156,2.5613205
436,3026,T,If you went faster what happened to your line? ,Q,PD,-1.9154725,-0.17404346
437,3026,T,What happened to the line? You’re getting there.,Q,OD,10.157727,6.588354
438,3026,T,You said you had to hurry up and get there. ,P,OD,-7.75016,8.478491
439,3026,T,"Why did you have to hurry up, because what were you trying to do? ",Q,OD,-0.062763,18.118013
440,3026,S,Match the line. ,Rs,OD,-3.7074008,14.9907255
441,3026,T,Match that line. ,Fy,OD,-3.7866094,14.912018
442,3026,T,Ok? So why do you need to go fast for some lines and slower for some lines? ,Q,PD,4.8758917,16.566154
443,3026,S,"Some, when you’re like that, you got to go up or down. ",Rs,PD,-7.5608926,-6.274726
444,3026,T,"Ok, so you’re talking about the slant of the line?",Fq,PD,4.9395103,18.185007
445,3026,S,Yeah. ,Ry,PD,1.6601876,-5.034238
446,3026,T,"Ok, we call that slope. ",Fs,SK,-7.892409,0.11902841
447,3026,T,Remember slope from math class? ,P,SK,-14.827388,-17.763947
448,3026,T,The slope of the line?,P,SK,-7.6374288,0.031837087
449,3026,T,"So how steep this line is, the slope of the line, that is your what? ",Q,SK,-7.164611,0.36663187
450,3026,S,Speed? ,Rs,SK,-8.140072,9.942984
451,3026,T,That’s your speed. ,Fy,SK,-8.2201395,10.118185
452,3026,T,"How steep this line is is dependent on how fast you are going, isn’t it? ",E,SK,-7.1929207,0.34877515
453,3026,T,"If you notice, if you ran real quickly it went steeper, but if you were slow it went up very slowly, right? ",E,PD,0.3930508,1.0066152
454,3026,T," Remember, it’s measuring your distance over time. ",E,PD,-16.73316,8.669763
455,3026,T,"So if you’re going faster you’re going over more distance in less time and that’s why your graphs are going to steeper, ok? ",E,PD,-7.322659,-6.8182464
456,3026,T,"Alright, can someone tell me what we mean by constant speed? ",Q,SK,12.351281,-16.2654
457,3026,T,"George, put the money up unless you’re going to buy me more pencils. ",P,,-5.9475603,3.0280235
458,3026,S,That’s all I got.,Rs,,-7.3773494,-6.7644258
459,3026,T,"What is meant by constant speed. George, [inaudible]. ",Q,SK,-7.6552925,9.721749
460,3026,S,The same speed? ,Rs,SK,-8.20489,10.043188
461,3026,T,"The speed stays the same, ok?",Fy,SK,18.898659,-4.5577674
462,3026,T,"That means your not accelerating, you’re not decelerating, you’re not slowing down or speeding up. ",E,SK,1.0524582,-5.6169877
463,3026,T,It’s staying constant; it’s staying the same. ,E,SK,-5.0104847,-17.7386
464,3026,T,And when you do your time graphs in just a minute you’re going to realize what happened when you do not move or you stay the same. ,E,OD,-7.982756,-5.658175
465,3026,T,What is the relationship between acceleration and velocity? Tell me what velocity is. ,Q,SK,-1.4366957,8.524226
466,3026,S,Speed? ,Rs,SK,-8.119021,10.103864
467,3026,T,"It deals with speed, but what else? ",Fq,SK,-4.1355968,-10.884731
468,3026,S,The direction. The direction of the motion. ,Rs,SK,18.840666,-4.4994984
469,3026,T,The direction of motion.,Fy,SK,18.837135,-4.496135
470,3026,T,"So we’re adding speed which is our rate of distance over time and we’re giving it direction, meaning, what direction are we going to walk in? ",E,SK,-4.1349864,-10.878066
471,3026,T,So if you look at that picture on page 134 it shows the path of someone walking around a park. ,E,OD,-7.982042,-5.662452
472,3026,T,"Do me a favor – run up to Ms. C[inaudible]’s, Ms. [inaudible] and Ms. [inaudible]’s room and see if any of these kids are in there because I owe them a lunch pass, ok? If they’re there, give it to them; if not, [inaudible]. ",P,,-5.9036856,3.0779235
473,3026,T,So velocity means – it’s depending on speed and direction. ,E,SK,-8.176853,10.089888
474,3026,T,"So if I’m walking a straight line, what could I do to change my velocity? ",Q,OD,-1.6156919,8.86009
475,3026,S,Run. ,Rs,OD,-6.4638143,2.4122448
476,3026,T,"I could go faster; I could start running, right?",Fs,OD,-16.85379,8.540272
477,3026,T,"That’s one way of changing velocity. Or, what if I stay at the same speed; I’m walking and walking and walking and I turn over here.",E,OD,-1.6072071,8.915186
478,3026,T,Will I change velocity? ,Q,OD,-1.5626544,8.36534
479,3026,S,No. Yes. You change like motion. ,Rs,OD,9.090215,-7.825264
480,3026,T,When I turn I change what?,Q,OD,-1.5504657,8.397878
481,3026,S,Velocity. Motion. Direction. ,Rs,OD,18.848055,-4.507022
482,3026,T,I change direction. ,Fs,OD,-1.9468584,8.194791
483,3026,T,"I may be going the same speed, but I changed directions so I have changed my velocity.",E,OD,-8.169607,12.988312
484,3026,T,So how is velocity related to acceleration? What’s the relationship between that? Those two things? ,Q,SK,-1.6013726,8.837707
485,3026,S,"Velocity, wants to be in the direction of motion and acceleration is change in velocity? ",Rs,SK,-1.8794255,8.278247
486,3026,T,Acceleration is what? Say it louder? ,Fq,SK,-6.4953594,2.3692229
487,3026,S,Acceleration is the speed – is the change in velocity? ,Rs,SK,-1.5837184,8.878986
488,3026,T,"Acceleration is the change of velocity, ok?",Fy,SK,-1.5634663,8.814956
489,3026,T,"So we know velocity means I must be in motion, I can change my speed, and I have to be moving in a particular direction, ok? ",E,SK,-2.3164754,0.42122254
490,3026,T,"And I’m moving right now, so do I have velocity? ",Q,OD,-7.7742863,8.70059
491,3026,S,No. ,Ry,OD,-11.111684,-9.860286
492,3026,T,"No. My speed is zero, but I’m not going in any direction right now, but once I move to a different direction I can change my velocity.",Fs,OD,-4.0798864,-10.939365
493,3026,T,"Ok, let’s answer one and two. Let’s look at a few of these graphs. ",P,OD,19.000496,-4.6599326
494,3026,T,"Tell me, and this is just your first try. ",P,,9.336211,7.010159
495,3026,T,"This was just your first try, so let’s look at this one. ",P,,6.1022754,-20.192913
496,3026,T,"This one turned out pretty good, ok? ",P,,-7.2637134,-6.73385
497,3026,T,So what did this person have to do to match this graph? ,Q,OD,4.938427,18.183548
498,3026,S,[inaudible]. Walk a lot.,Rs,OD,-7.3421187,9.447297
499,3026,T,Hold on. You’ve got to tell me where he had to start; ,P,OD,10.28807,6.462776
500,3026,T,you’ve got to be specific in your description.,P,OD,8.632169,-6.8681173
501,3026,T,You have to start how far away from the wall? ,P,OD,-7.891181,21.350271
502,3026,S,One? ,Rs,OD,-10.978394,-10.095328
503,3026,T,He had to start one foot away ,Fs,OD,-6.7967987,19.608631
504,3026,T,and then which way did he have to walk? ,Q,OD,8.973751,-7.947128
505,3026,S,Backwards. ,Rs,OD,-1.7440653,8.097719
506,3026,T,He had to go back. ,Fs,OD,-11.31777,-9.839256
507,3026,T,How many meters back did he have to go? ,Q,OD,8.627508,-7.6449895
508,3026,S,Three. One. ,Rs,OD,-11.333635,-9.768021
509,3026,T,One.,Fy,,-11.108643,-9.784276
510,3026,T,See how that ended up one extra meter?,Q,OD,0.8085174,4.5287232
511,3026,S,Yeah. ,Rs,OD,1.6642061,-5.0062594
512,3026,T,How long did he have to walk back to that other meter? ,Q,OD,8.96842,-7.783967
513,3026,S,Three.,Rs,OD,-10.974802,-9.7151375
514,3026,T,How long did it [inaudible]? ,Q,OD,8.785318,-7.7236114
515,3026,S,Three? ,Rs,OD,-11.212028,-9.678676
516,3026,T,"Ok, ",Fy,OD,6.32065,-20.39723
517,3026,T,so he had to walk back for how many seconds? Count. How many seconds? How many seconds did he have to walk backwards for?,Q,OD,8.502376,-6.6250315
518,3026,S,Three. ,Rs,OD,-11.067734,-10.04577
519,3026,T,"Three, right? ",Fy,OD,-16.769127,8.594216
520,3026,T,So he had to judge it. How did we get that straight line? ,Q,PD,-7.9325943,21.349022
521,3026,S,Just stay there. ,Rs,PD,1.6672361,-4.6054974
522,3026,T,"He stopped, right? ",Fy,PD,-19.330412,7.3582954
523,3026,T,And what was our speed at that point?,Q,PD,-0.29778826,-10.953013
524,3026,S,Zero. ,Rs,PD,-4.1763153,-10.855545
525,3026,T,"Zero; you weren’t moving, were you? ",Fs,PD,-3.9070275,-11.119643
526,3026,T,"Then, what did we do here? How long did he have to stand there and do nothing? ",Q,OD,8.64531,-6.880525
527,3026,S,Like four seconds. ,Rs,OD,9.078327,-7.786977
528,3026,T,"Yeah, about one, two, three, four seconds, ",Fs,OD,1.7777339,-4.9122705
529,3026,T,and after four seconds what did he have to do? ,Q,OD,9.116312,-7.819825
530,3026,S,Walk back. ,Rs,OD,8.960994,-7.909753
531,3026,T,"Walk forward again, right? Ok.",Fs,OD,-5.208079,-17.925985
532,3026,T,"now at that point, at what two points did the velocity change on this? Remember what – for velocity to change are what two thing? ",Q,PD,-5.3956213,14.819253
533,3026,S,Velocity. ,Rs,PD,-1.80181,8.114315
534,3026,T,What two things make up velocity? ,Q,SK,-1.4358646,8.521725
535,3026,S,Speed. ,Rs,SK,-8.256426,9.997356
536,3026,T,Speed or… ,Fq,SK,-8.131706,10.150671
537,3026,S,Direction. ,Rs,SK,6.2481165,-20.349272
538,3026,T,Direction. ,Fy,SK,6.3587875,-20.428808
539,3026,T,So can you tell me the two places on this graph where he changed velocity? ,Q,PD,-1.9925277,-0.076678626
540,3026,S,In the middle. ,Rs,PD,-5.5312433,14.743582
541,3026,T,One – we’re almost done – two… ,Fs,PD,-11.368579,-9.983738
542,3026,S,Where it changed? ,Rq,PD,-8.249167,13.687189
543,3026,T,Show me where he changed velocity. Show me.,P,PD,-8.171407,13.159827
544,3026,T,At what specific point did he either change speed or change direction. ,Q,PD,8.530564,-6.661164
545,3026,T,"One, two – Gene, you need to sit in the back, please.",P,,-6.792309,19.604094
546,3026,S,Alright. ,Ry,,8.970549,-7.899351
547,3026,T,"…three, four. Johnny, come help him out. ",P,,8.699643,-7.006808
548,3026,T,"Where did he either change speed or change direction? Hold on, what specific point? ",Q,PD,8.556918,-6.6803694
549,3026,S,[inaudible] ,,,-6.363527,2.530016
550,3026,T,"You all listening? One, two, three… Alright. ",P,,9.004059,-7.8167396
551,3026,T,"You see right here? What happens at this point? Right here at this point, what happened? What did he do? ",Q,OD,-3.6975918,14.993589
552,3026,S,He stopped. ,Rs,OD,6.208176,-20.302683
553,3026,T,He stopped. ,Fy,OD,6.1655498,-20.299475
554,3026,T,Did he change his speed? ,Q,PD,8.723257,-7.039243
555,3026,S,"No. If he stops he changes speed, yes. Oh, yeah. Yeah.",Rs,PD,9.496473,7.114062
556,3026,T,"Ok, what about right here? What did he change?",Q,OD,-5.3190885,14.840909
557,3026,T,"Guys, I’m not talking over you. ",P,,-3.6798997,15.008337
558,3026,T,What did he change right here? Raise your hands. ,Q,PD,11.555748,-6.170213
559,3026,S,He walked forward. ,Rs,PD,-5.031408,-17.759224
560,3026,T,"He walked forward, ",Fy,OD,-5.1471996,-17.874662
561,3026,T,so what did he change when he started to walk forward? ,Q,PD,8.987688,-7.964721
562,3026,S,Velocity.,Rs,PD,-1.7132994,8.193925
563,3026,T,"Why, because he changed what about velocity? ",Fq,PD,-8.144226,13.066891
564,3026,S,Direction.,Rs,PD,6.2149367,-20.379578
565,3026,T,"Direction, thank you. ",Fy,PD,-7.8475237,0.15290396
